{
  "contractVersion": "discovery-packet-v2",
  "candidateId": "heygen-com/hyperframes",
  "lifecycle": [
    "discovered",
    "fetched",
    "parsed",
    "normalized",
    "deduped",
    "mapped",
    "review-ready"
  ],
  "source": {
    "canonicalUrl": "https://github.com/heygen-com/hyperframes/blob/7a2a6917367e6dd7ce22f4c321c4a852dcf58dfd/skills/hyperframes/SKILL.md",
    "hostRepository": "https://github.com/heygen-com/hyperframes",
    "sourceLane": "source-repository",
    "fetchedAt": "2026-09-06T15:16:16Z",
    "contentSha256": "a6e5a1f0c8f65f54864530dd2c8fb7ae828bf55069188c2fa386da6696bc8d1e",
    "frontmatter": {
      "name": "hyperframes",
      "description": "Mandatory entry point: read this first for any request to make, create, edit, animate, or render a video, animation, or motion graphic, including a promo, explainer, captioned clip, title card, overlay, slideshow or interactive deck, Remotion port, or any HyperFrames HTML composition. Also use it to inspect, diagnose, validate, preview, publish, or batch-render an existing HyperFrames project. Inputs may be a website URL, GitHub PR, Figma design or URL, text or brief, existing footage, or music. It resumes project state, captures intent when applicable, selects and installs the owning workflow, and routes domain capabilities. HyperFrames is the default output framework unless the user explicitly chooses another framework for the deliverable or asks only to record a browser session."
    },
    "commitSha": "7a2a6917367e6dd7ce22f4c321c4a852dcf58dfd"
  },
  "normalized": {
    "name": "hyperframes",
    "description": "Mandatory entry point: read this first for any request to make, create, edit, animate, or render a video, animation, or motion graphic, including a promo, explainer, captioned clip, title card, overlay, slideshow or interactive deck, Remotion port, or any HyperFrames HTML composition. Also use it to inspect, diagnose, validate, preview, publish, or batch-render an existing HyperFrames project. Inputs may be a website URL, GitHub PR, Figma design or URL, text or brief, existing footage, or music. It resumes project state, captures intent when applicable, selects and installs the owning workflow, and routes domain capabilities. HyperFrames is the default output framework unless the user explicitly chooses another framework for the deliverable or asks only to record a browser session."
  },
  "exactDedupe": {
    "matched": false
  },
  "mappingOptions": [
    {
      "genericId": "video-composition",
      "rationale": "Lexical and architectural match to programmatic video composition framework (Suite Capstone).",
      "similarity": 0.872,
      "matchTier": "strong"
    }
  ],
  "suite": {
    "role": "capstone",
    "suiteId": "hyperframes",
    "componentCandidateIds": [
      "heygen-com/hyperframes-core",
      "heygen-com/hyperframes-animation",
      "heygen-com/hyperframes-audio",
      "heygen-com/hyperframes-cli",
      "heygen-com/hyperframes-creative",
      "heygen-com/hyperframes-keyframes",
      "heygen-com/hyperframes-registry",
      "heygen-com/media-use",
      "heygen-com/motion-graphics",
      "heygen-com/music-to-video",
      "heygen-com/pr-to-video",
      "heygen-com/product-launch-video",
      "heygen-com/remotion-to-hyperframes",
      "heygen-com/slideshow",
      "heygen-com/talking-head-recut"
    ]
  },
  "genericSnapshot": {
    "capturedAt": "2026-09-06T15:16:16Z",
    "command": "gaia dev list --generic --json",
    "generics": [
      {
        "id": "adaptive-pattern-learning",
        "name": "Adaptive Pattern Learning",
        "kind": "generic"
      },
      {
        "id": "advanced-swarm-coordination",
        "name": "Advanced Swarm Coordination",
        "kind": "generic"
      },
      {
        "id": "adversarial-robustness-testing",
        "name": "Adversarial Robustness Testing",
        "kind": "generic"
      },
      {
        "id": "agent-environment-setup",
        "name": "agent-environment-setup",
        "kind": "generic"
      },
      {
        "id": "agent-eval",
        "name": "Agent Evaluation",
        "kind": "generic"
      },
      {
        "id": "agent-fusion",
        "name": "Agent Fusion",
        "kind": "generic"
      },
      {
        "id": "agent-handoff",
        "name": "agent-handoff",
        "kind": "generic"
      },
      {
        "id": "agent-memory-learning",
        "name": "Agent Memory Learning",
        "kind": "generic"
      },
      {
        "id": "agent-memory-platform",
        "name": "Agent Memory Platform",
        "kind": "generic"
      },
      {
        "id": "agent-reach",
        "name": "Agent Reach",
        "kind": "generic"
      },
      {
        "id": "agentic-workflow-design",
        "name": "Agentic Workflow Design",
        "kind": "generic"
      },
      {
        "id": "api-call",
        "name": "API Call",
        "kind": "generic"
      },
      {
        "id": "architecture-diagram",
        "name": "Architecture Diagram",
        "kind": "generic"
      },
      {
        "id": "audience-model",
        "name": "Audience Model",
        "kind": "generic"
      },
      {
        "id": "auto-review",
        "name": "Auto-Review",
        "kind": "generic"
      },
      {
        "id": "automated-testing",
        "name": "Automated Testing",
        "kind": "generic"
      },
      {
        "id": "autonomous-data-scientist",
        "name": "Autonomous Data Scientist",
        "kind": "generic"
      },
      {
        "id": "autonomous-debug",
        "name": "Autonomous Debug",
        "kind": "generic"
      },
      {
        "id": "autonomous-engineering-platform",
        "name": "Autonomous Engineering Platform",
        "kind": "generic"
      },
      {
        "id": "autonomous-web-research",
        "name": "Autonomous Web Research",
        "kind": "generic"
      },
      {
        "id": "bioinformatic-sequence-analysis",
        "name": "Bioinformatic Sequence Analysis",
        "kind": "generic"
      },
      {
        "id": "brainstorming",
        "name": "Brainstorming",
        "kind": "generic"
      },
      {
        "id": "brand-guideline-application",
        "name": "Brand Guideline Application",
        "kind": "generic"
      },
      {
        "id": "browser-automation",
        "name": "Browser Automation",
        "kind": "generic"
      },
      {
        "id": "browser-control",
        "name": "Browser Control",
        "kind": "generic"
      },
      {
        "id": "career-operations",
        "name": "Career Operations",
        "kind": "generic"
      },
      {
        "id": "causal-inference",
        "name": "Causal Inference",
        "kind": "generic"
      },
      {
        "id": "chain-of-thought",
        "name": "Chain-of-Thought Reasoning",
        "kind": "generic"
      },
      {
        "id": "cheminformatics-analysis",
        "name": "Cheminformatics Analysis",
        "kind": "generic"
      },
      {
        "id": "chunk-document",
        "name": "Chunk Document",
        "kind": "generic"
      },
      {
        "id": "ci-churn-analysis",
        "name": "CI Churn Analysis",
        "kind": "generic"
      },
      {
        "id": "cite-sources",
        "name": "Cite Sources",
        "kind": "generic"
      },
      {
        "id": "classify",
        "name": "Classify",
        "kind": "generic"
      },
      {
        "id": "cli-modernization",
        "name": "CLI Modernization",
        "kind": "generic"
      },
      {
        "id": "clinical-data-retrieval",
        "name": "Clinical Data Retrieval",
        "kind": "generic"
      },
      {
        "id": "cloud-platform-management",
        "name": "Cloud Platform Management",
        "kind": "generic"
      },
      {
        "id": "code-execution",
        "name": "Code Execution",
        "kind": "generic"
      },
      {
        "id": "code-explain",
        "name": "Code Explain",
        "kind": "generic"
      },
      {
        "id": "code-generation",
        "name": "Code Generation",
        "kind": "generic"
      },
      {
        "id": "code-review-pipeline",
        "name": "Code Review Pipeline",
        "kind": "generic"
      },
      {
        "id": "collaborative-diagramming",
        "name": "Collaborative Diagramming",
        "kind": "generic"
      },
      {
        "id": "computational-biology-workflows",
        "name": "Computational Biology Workflows",
        "kind": "generic"
      },
      {
        "id": "computational-science-platform",
        "name": "Computational Science Platform",
        "kind": "generic"
      },
      {
        "id": "computer-use",
        "name": "Computer Use",
        "kind": "generic"
      },
      {
        "id": "content-moderation",
        "name": "Content Moderation",
        "kind": "generic"
      },
      {
        "id": "context-compression",
        "name": "Context Compression",
        "kind": "generic"
      },
      {
        "id": "conversational-agent",
        "name": "Conversational Agent",
        "kind": "generic"
      },
      {
        "id": "core-platform-implementation",
        "name": "Core Platform Implementation",
        "kind": "generic"
      },
      {
        "id": "crm-data-cleanup",
        "name": "CRM Data Cleanup",
        "kind": "generic"
      },
      {
        "id": "cultural-localization",
        "name": "Cultural Localization",
        "kind": "generic"
      },
      {
        "id": "data-analysis",
        "name": "Data Analysis",
        "kind": "generic"
      },
      {
        "id": "data-visualize",
        "name": "Data Visualize",
        "kind": "generic"
      },
      {
        "id": "decision-ticket-planning",
        "name": "Decision Ticket Planning",
        "kind": "generic"
      },
      {
        "id": "deployment-automation",
        "name": "Deployment Automation",
        "kind": "generic"
      },
      {